id,source_name,dest_name,source_abbrev,dest_abbrev,amount,amount_inr,amount_usd
0,,"Ministry of Consumer Affairs, Food and Public Distribution",,mocafapd,205651.33000000002,2056513300000.0002,24194274117.64706
1,"Ministry of Consumer Affairs, Food and Public Distribution",Department of Consumer Affairs,mocafapd,mocafapd_doca,250.66,2506600000.0,29489411.76470588
2,"Ministry of Consumer Affairs, Food and Public Distribution",Department of Food and Public Distribution,mocafapd,mocafapd_dofapd,205400.67,2054006700000.0002,24164784705.882355
3,Department of Consumer Affairs,CENTRE'S EXPENDITURE,mocafapd_doca,mocafapd_doca_cse,250.66,2506600000.0,29489411.76470588
4,CENTRE'S EXPENDITURE,Central Sector Schemes/Projects,mocafapd_doca_cse,mocafapd_doca_cse_cssp,113.5,1135000000.0,13352941.176470589
5,CENTRE'S EXPENDITURE,Establishment Expenditure of the Centre,mocafapd_doca_cse,mocafapd_doca_cse_eeotc,137.16,1371600000.0,16136470.588235294
6,Central Sector Schemes/Projects,Consumer Protection,mocafapd_doca_cse_cssp,mocafapd_doca_cse_cssp_cp,68.0,680000000.0,8000000.0
7,Central Sector Schemes/Projects,Legal Metrology and Quality Assurance,mocafapd_doca_cse_cssp,mocafapd_doca_cse_cssp_lmaqa,45.5,455000000.0,5352941.176470588
8,Consumer Protection,CONFONET,mocafapd_doca_cse_cssp_cp,mocafapd_doca_cse_cssp_cp_c,38.589999999999996,385899999.99999994,4539999.999999999
9,Consumer Protection,Unallocated,mocafapd_doca_cse_cssp_cp,mocafapd_doca_cse_cssp_cp_u,29.410000000000004,294100000.00000006,3460000.000000001
10,CONFONET,Consumer Awareness (Advertising and Publicity),mocafapd_doca_cse_cssp_cp_c,mocafapd_doca_cse_cssp_cp_c_caaap,17.99,179899999.99999997,2116470.588235294
11,CONFONET,Consumer Protection Cell,mocafapd_doca_cse_cssp_cp_c,mocafapd_doca_cse_cssp_cp_c_cpc,7.6,76000000.0,894117.6470588235
12,CONFONET,Price Monitoring Structure,mocafapd_doca_cse_cssp_cp_c,mocafapd_doca_cse_cssp_cp_c_pms,6.0,60000000.0,705882.3529411765
13,CONFONET,"Strengthening Consumer Forum, Consumer Counseling and Mediation",mocafapd_doca_cse_cssp_cp_c,mocafapd_doca_cse_cssp_cp_c_scfccam,7.0,70000000.0,823529.4117647059
14,Legal Metrology and Quality Assurance,Bureau of Indian Standard,mocafapd_doca_cse_cssp_lmaqa,mocafapd_doca_cse_cssp_lmaqa_bois,0.5,5000000.0,58823.529411764706
15,Legal Metrology and Quality Assurance,National Test House,mocafapd_doca_cse_cssp_lmaqa,mocafapd_doca_cse_cssp_lmaqa_nth,17.0,170000000.0,2000000.0
16,Legal Metrology and Quality Assurance,Strengthening of Weights and Measures Infrastructure and Strengthening of Regional Reference Standard Laboratories and Indian Institute of Legal Metrology,mocafapd_doca_cse_cssp_lmaqa,mocafapd_doca_cse_cssp_lmaqa_sowamiasorrslaiiolm,28.0,280000000.0,3294117.6470588236
17,Bureau of Indian Standard,Setting-up of Gold Hallmarking / Assaying Centers in India,mocafapd_doca_cse_cssp_lmaqa_bois,mocafapd_doca_cse_cssp_lmaqa_bois_suoghacii,0.5,5000000.0,58823.529411764706
18,Department of Food and Public Distribution,CENTRE'S EXPENDITURE,mocafapd_dofapd,mocafapd_dofapd_cse,197976.07,1979760700000.0,23291302352.941177
19,Department of Food and Public Distribution,TRANSFERS TO STATES/UTs,mocafapd_dofapd,mocafapd_dofapd_ttsu,7424.6,74246000000.0,873482352.9411764
20,CENTRE'S EXPENDITURE,Central Sector Schemes/Projects,mocafapd_dofapd_cse,mocafapd_dofapd_cse_cssp,197868.57,1978685700000.0,23278655294.117645
21,CENTRE'S EXPENDITURE,Other Central Sector Expenditure,mocafapd_dofapd_cse,mocafapd_dofapd_cse_ocse,26.01,260100000.00000003,3060000.0000000005
22,CENTRE'S EXPENDITURE,"Other Establishment Expenditure of Food, Storage and Warehousing",mocafapd_dofapd_cse,mocafapd_dofapd_cse_oeeofsaw,81.49,814900000.0,9587058.823529411
23,Central Sector Schemes/Projects,Development of Sugar Industry,mocafapd_dofapd_cse_cssp,mocafapd_dofapd_cse_cssp_dosi,118.57,1185700000.0,13949411.764705881
24,Central Sector Schemes/Projects,Food Subsidy,mocafapd_dofapd_cse_cssp,mocafapd_dofapd_cse_cssp_fs,197350.0,1973500000000.0,23217647058.82353
25,Central Sector Schemes/Projects,Scheme for extending financial assistance to sugar mills for enhancement and augmentation of ethanol production capacity,mocafapd_dofapd_cse_cssp,mocafapd_dofapd_cse_cssp_sfefatsmfeaaoepc,400.0,4000000000.0,47058823.52941176
26,Development of Sugar Industry,Storage and Godowns,mocafapd_dofapd_cse_cssp_dosi,mocafapd_dofapd_cse_cssp_dosi_sag,103.57,1035699999.9999999,12184705.882352939
27,Development of Sugar Industry,Schemes for Development of Sugar Industries,mocafapd_dofapd_cse_cssp_dosi,mocafapd_dofapd_cse_cssp_dosi_sfdosi,10.0,100000000.0,1176470.5882352942
28,Development of Sugar Industry,Strengthening of PDS Operations,mocafapd_dofapd_cse_cssp_dosi,mocafapd_dofapd_cse_cssp_dosi_sopo,5.0,50000000.0,588235.2941176471
29,Schemes for Development of Sugar Industries,Financial Assistance to Sugar Undertakings/Other Expenditure,mocafapd_dofapd_cse_cssp_dosi_sfdosi,mocafapd_dofapd_cse_cssp_dosi_sfdosi_fatsuoe,10.0,100000000.0,1176470.5882352942
30,Food Subsidy,Food Subsidy for Decentralized Procurement of Foodgrains under NFSA,mocafapd_dofapd_cse_cssp_fs,mocafapd_dofapd_cse_cssp_fs_fsfdpofun,59793.0,597930000000.0,7034470588.235294
31,Food Subsidy,Food Subsidy  to Food Corporation of India under National Food Security Act.,mocafapd_dofapd_cse_cssp_fs,mocafapd_dofapd_cse_cssp_fs_fstfcoiunfsa,137207.0,1372070000000.0,16142000000.0
32,Food Subsidy,Sugar Subsidy payable under Public Distribution System,mocafapd_dofapd_cse_cssp_fs,mocafapd_dofapd_cse_cssp_fs_sspupds,350.0,3500000000.0,41176470.5882353
33,Other Central Sector Expenditure,Autonomous Bodies,mocafapd_dofapd_cse_ocse,mocafapd_dofapd_cse_ocse_ab,22.0,220000000.0,2588235.294117647
34,Other Central Sector Expenditure,Others,mocafapd_dofapd_cse_ocse,mocafapd_dofapd_cse_ocse_o,4.01,40100000.0,471764.70588235295
35,Autonomous Bodies,Warehousing Development and Regulatory Authority,mocafapd_dofapd_cse_ocse_ab,mocafapd_dofapd_cse_ocse_ab_wdara,22.0,220000000.0,2588235.294117647
36,Others,Generating Awareness amongst TPDS beneficiaries,mocafapd_dofapd_cse_ocse_o,mocafapd_dofapd_cse_ocse_o_gaatb,3.67,36700000.0,431764.70588235295
37,Others,"PDS-Evaluation, Monitoring & Research",mocafapd_dofapd_cse_ocse_o,mocafapd_dofapd_cse_ocse_o_pemr,0.34,3400000.0000000005,40000.00000000001
38,TRANSFERS TO STATES/UTs,Centrally Sponsored Schemes,mocafapd_dofapd_ttsu,mocafapd_dofapd_ttsu_css,7424.6,74246000000.0,873482352.9411764
39,Centrally Sponsored Schemes,Assistance to States Agencies for Intra-State Movement of Foodgrains and FPS Dealers Margin under NFSA,mocafapd_dofapd_ttsu_css,mocafapd_dofapd_ttsu_css_atsafismofafdmun,7424.6,74246000000.0,873482352.9411764
